{
  "platform": "Facebook",
  "url": "https://example.com/reputation-issue",
  "text": "Has anyone worked with Pryceless Ventures? Heard they took deposits and stopped responding. Is this legit?",
  "author": "fb_user_reputation",
  "created_at": "2025-12-15T12:03:47Z",
  "source_query": "Pryceless Ventures legit"
}