{
  "platform": "BiggerPockets",
  "url": "https://example.com/content-topic",
  "text": "Texas taxes and insurance are killing my DSCR. What\u2019s the right underwriting process so I don\u2019t get burned?",
  "author": "bp_user_content",
  "created_at": "2025-12-15T12:04:07Z",
  "source_query": "Texas DSCR taxes insurance underwriting"
}